<?xml version="1.0" encoding="UTF-8"?>
<Izvestaj_o_imunizaciji 
    xmlns="http://www.ftn.uns.ac.rs/xml_i_veb_servisi/izvestaj_o_imunizaciji"
    xmlns:xsi="http://www.w3.org/2001/XMLSchema-instance"
    xmlns:pred="http://www.ftn.uns.ac.rs/rdf/zalbacutanje/predicate/"
    xsi:schemaLocation="http://www.ftn.uns.ac.rs/xml_i_veb_servisi/izvestaj_o_imunizaciji file:/D:/faks/xml/xmlProject/backend-gradjanin/data/schema/izvestaj_sema.xsd"
    about="http://www.ftn.uns.ac.rs/xml_i_veb_servisi/izvestaj_o_imunizaciji/2021-10-10T00:00:00/2021-12-10T00:00:00">
    <Period_izvestaja>
        <Pocetak_perioda property="pred:pocetak_perioda">2021-10-10T00:00:00</Pocetak_perioda>
        <Kraj_perioda property="pred:kraj_perioda">2021-12-10T00:00:00</Kraj_perioda>
    </Period_izvestaja>
    <Podaci_o_zahtevima>
        <Broj_dokumenata_o_interesovanju>3</Broj_dokumenata_o_interesovanju>
        <Broj_zahteva>
            <Primljeno>34</Primljeno>
            <Izdato>30</Izdato>
        </Broj_zahteva>
    </Podaci_o_zahtevima>
    <Lista_vakcina>
        <Vakcina>
            <Redni_broj_doze>1</Redni_broj_doze>
            <Broj_datih_doza>1</Broj_datih_doza>
        </Vakcina>
        <Vakcina>
            <Redni_broj_doze>2</Redni_broj_doze>
            <Broj_datih_doza>2</Broj_datih_doza>
        </Vakcina>
    </Lista_vakcina>
    <Raspodela_po_proizvodjacima>
        <Proizvodjac>
            <Ime_proizvodjaca>Prozivodjac1</Ime_proizvodjaca>
            <Broj_doza>2</Broj_doza>
        </Proizvodjac>
        <Proizvodjac>
            <Ime_proizvodjaca>Prozivodjac1</Ime_proizvodjaca>
            <Broj_doza>2</Broj_doza>
        </Proizvodjac>
    </Raspodela_po_proizvodjacima>
    <Datum_izdavanja property="pred:datum_izdavanja">2021-12-10T00:01:00</Datum_izdavanja>
</Izvestaj_o_imunizaciji>